{
  "$schema": "../../../../src/Oxygen/Cooker/Import/Schemas/oxygen.texture-descriptor.schema.json",
  "source": "../../images/showcase/Wood051_1K-JPG_NormalGL.jpg",
  "intent": "normal",
  "decode": {
    "color_space": "linear",
    "flip_normal_green": true
  },
  "output": {
    "format": "bc7"
  }
}
